episode_name,season_number,episode_number,Serial Key,story_number,episode_title,aired year,first_aired data,production_code,uk_viewers(millions),uk_viewers,rating,duration,writer,director,doctor,imdb_rating,rating_n,rating_n/viewers(%),desc
S11E7 Kerblam!,11,7,S11E7,283,Kerblam!,2018,2018-11-18,NA,7.46,7460000.00,81,49,Pete McTighe,Jennifer Perrott,Jodie Whittaker,6.1,5843,0.08,"A mysterious message arrives in a package addressed to the Doctor, leading her, Graham, Yaz and Ryan to investigate the warehouse moon orbiting Kandoka, and the home of the galaxy's largest retailer."
S11E8 The Witchfinders,11,8,S11E8,284,The Witchfinders,2018,2018-11-25,NA,7.21,7210000.00,81,47,Joy Wilkinson,Sallie Aprahamian,Jodie Whittaker,5.5,5499,0.08,"Arriving in 17th Century Lancashire, the TARDIS team become embroiled in a witch trial. With the arrival of King James I, the hunt for witches intensifies. However, could something more dangerous be at play? Can the Doctor, Graham, Yaz and Ryan keep the populace of Bilehurst Cragg safe from the forces surrounding the land?"
S11E9 It Takes You Away,11,9,S11E9,285,It Takes You Away,2018,2018-12-02,NA,6.42,6420000.00,80,49,Ed Hime,Jamie Childs,Jodie Whittaker,6,5280,0.08,"On the edge of a Norwegian fjord, in the present day, The Doctor, Ryan, Graham and Yaz discover a boarded-up cottage and a girl named Hanne in need of their help. What has happened here? What monster lurks in the woods around the cottage - and beyond?"
S11E10 The Battle of Ranskoor Av Kolos,11,10,S11E10,286,The Battle of Ranskoor Av Kolos,2018,2018-12-09,NA,6.65,6650000.00,79,50,Chris Chibnall,Jamie Childs,Jodie Whittaker,5,4804,0.07,"Answering nine separate distress calls, the Doctor and team arrive on the remnants of a brutal battlefield on the planet Ranskoor Av Kolos. This planet has many secrets. An amnesiac commander? Mysterious mists? Who or what are the Ux? A deadly reckoning awaits the Doctor and team once they have the answers...."
S11E11 Resolution,11,11,S11E11,287,Resolution,2019,2019-01-01,NA,7.13,7130000.00,80,60,Chris Chibnall,Wayne Yip,Jodie Whittaker,5.6,4698,0.07,"As the New Year begins, a terrifying evil is stirring from across the centuries of Earth's history. As the Doctor, Ryan, Graham and Yaz return home, will they be able to overcome the threat to planet Earth?"
"S12E1 Spyfall, Part 1",12,1,S12E1,288a,"Spyfall, Part 1",2020,2020-01-01,NA,6.89,6890000.00,82,59,Chris Chibnall,Jamie Magnus Stone,Jodie Whittaker,6.4,5401,0.08,"When intelligence agents around the world come under attack from alien forces, MI6 turns to the only person who can help... The Doctor."
"S12E2 Spyfall, Part 2",12,2,S12E2,288b,"Spyfall, Part 2",2020,2020-01-05,NA,6.07,6070000.00,82,60,Chris Chibnall,Lee Haven Jones,Jodie Whittaker,6.3,4781,0.08,A terrifying plan to destroy humanity is about to reach fruition. Can the Doctor and her friends escape multiple traps and defeat a deadly alliance?
S12E3 Orphan 55,12,3,S12E3,289,Orphan 55,2020,2020-01-12,NA,5.38,5380000.00,77,46,Ed Hime,Lee Haven Jones,Jodie Whittaker,3.9,5383,0.1,"Having decided that everyone could do with a holiday, Graham accidentally teleports himself, the Doctor Yasmin and Ryan to a luxury resort for a spot of rest and relaxation. However, they discover the place where they are having a break is hiding a number of deadly secrets. What are the ferocious monsters that are attacking Tranquility Spa?"
S12E4 Nikola Tesla's Night of Terror,12,4,S12E4,290,Nikola Tesla's Night of Terror,2020,2020-01-19,NA,5.2,5200000.0,79,50,Nina Metivier,Nida Manzoor,Jodie Whittaker,6.3,4292,0.08,"The time: the earliest years of the 20th century. The place: New York City. Inventor Nikola Tesla is at war with his rival Thomas Edison. However, there's an even greater threat in their midst."
S12E5 Fugitive of the Judoon,12,5,S12E5,291,Fugitive of the Judoon,2020,2020-01-26,NA,5.57,5570000.00,83,50,Chris Chibnall,Nida Manzoor,Jodie Whittaker,7.3,4692,0.08,"Stomping their way into present-day Gloucester, the Judoon are on the hunt for someone on the run. Who is this fugitive? And why are these alien mercenaries after them?"
S12E6 Praxeus,12,6,S12E6,292,Praxeus,2020,2020-02-02,NA,5.22,5220000.00,78,49,Chris Chibnall,Jamie Magnus Stone,Jodie Whittaker,5,3860,0.07,The Doctor and her friends split up to investigate multiple mysteries across planet Earth. What they find will threaten all of humanity.
S12E7 Can You Hear Me?,12,7,S12E7,293,Can You Hear Me?,2020,2020-02-09,NA,4.9,4900000.0,78,49,Chris Chibnall,Emma Sullivan,Jodie Whittaker,5.5,3451,0.07,"From ancient Syria to present day Sheffield, and out into the wilds of space, something is stalking the Doctor and infecting people's nightmares."
S12E8 The Haunting of Villa Diodati,12,8,S12E8,294,The Haunting of Villa Diodati,2020,2020-02-16,NA,5.07,5070000.00,80,49,Maxine Alderton,Emma Sullivan,Jodie Whittaker,6.9,3582,0.07,"Villa Diodati, 1816 - on a night that inspired Mary Shelley's Frankenstein. The plan was to spend the evening in the presence of literary greats - but the ghosts are all too real. And the Doctor is forced into an earth-shattering decision."
S12E9 Ascension of the Cybermen,12,9,S12E9,295a,Ascension of the Cybermen,2020,2020-02-23,NA,4.99,4990000.00,81,49,Chris Chibnall,Jamie Magnus Stone,Jodie Whittaker,6.3,3355,0.07,"In the far future, the Doctor and her friends face a brutal battle across the farthest reaches of space to protect the last of the human race against the deadly Cybermen."
S12E10 The Timeless Children,12,10,S12E10,295b,The Timeless Children,2020,2020-03-01,NA,4.69,4690000.00,82,65,Chris Chibnall,Jamie Magnus Stone,Jodie Whittaker,4.9,4743,0.1,"In the epic and emotional season finale, the Cybermen are on the march. As the last remaining humans are ruthlessly hunted down, Graham, Ryan and Yaz face a terrifying fight to survive. Civilisations fall. Others rise anew. Lies are exposed, truths are revealed, battles are fought, and for the Doctor - trapped and alone - nothing will ever be the same again."
S12E11 Revolution of the Daleks,12,11,S12E11,296,Revolution of the Daleks,2021,2021-01-01,NA,6.36,6360000.00,79,71,Chris Chibnall,Lee Haven Jones,Jodie Whittaker,5.8,2808,0.04,"Robertson returns, and inadvertently gives the mutant Dalek a chance to clone itself. The Doctor escapes from her alien prison with the help of an old friend, and returns to help."
S13E1 The Halloween Apocalypse,13,1,S13E1,297a,The Halloween Apocalypse,2021,2021-10-31,NA,5.81,5810000.00,76,50,Chris Chibnall,Jamie Magnus Stone,Jodie Whittaker,6.7,4912,0.08,"At Halloween, all across the universe, terrifying forces are stirring. From the Arctic Circle to deep space, an ancient evil is breaking free. And in present day Liverpool, the life of Dan Lewis is about to change forever."
S13E2 War of the Sontarans,13,2,S13E2,297b,War of the Sontarans,2021,2021-11-07,NA,5.13,5130000.00,77,59,Chris Chibnall,Jamie Magnus Stone,Jodie Whittaker,7,4047,0.08,"During the Crimean War, the Doctor discovers the British army fighting a brutal alien army of Sontarans, as Yaz and Dan are thrown deeper into a battle for survival. What is the Temple of Atropos? Who are the Mouri?"
"S13E3 Once, Upon Time",13,3,S13E3,297c,"Once, Upon Time",2021,2021-11-14,NA,4.7,4700000.0,75,49,Chris Chibnall,Azhur Saleem,Jodie Whittaker,6,3488,0.07,"Time is beginning to run wild. On a planet that shouldn't exist, in the aftermath of apocalypse, the Doctor, Dan, Yaz, and Vinder face a battle to survive."
S13E4 Village of the Angels,13,4,S13E4,297d,Village of the Angels,2021,2021-11-21,NA,4.57,4570000.00,79,56,Chris Chibnall,Jamie Magnus Stone,Jodie Whittaker,7.7,4097,0.09,"Devon, November 1967. A little girl has gone missing, Prof Jericho is conducting psychic experiments and in the graveyard there is one gravestone too many. Why is Medderton known as The Cursed Village and what do the Weeping Angel..."
S13E5 Survivors of the Flux,13,5,S13E5,297e,Survivors of the Flux,2021,2021-11-28,NA,4.83,4830000.00,77,51,Chris Chibnall,Azhur Saleem,Jodie Whittaker,6.1,3343,0.07,"As the forces of evil mass, the Doctor, Yaz and Dan face perilous journeys and seemingly insurmountable obstacles in their quest for survival."
S13E6 The Vanquishers,13,6,S13E6,297f,The Vanquishers,2021,2021-12-05,NA,4.64,4640000.00,76,59,Chris Chibnall,Azhur Saleem,Jodie Whittaker,5.4,3547,0.08,"In the final epic chapter in the story of the Flux, all hope is lost. The forces of darkness are in control. But when the monsters have won, who can you count upon to save the universe?"