episode_name,season_number,episode_number,Serial Key,story_number,episode_title,aired year,first_aired data,production_code,uk_viewers(millions),uk_viewers,rating,duration,writer,director,doctor,imdb_rating,rating_n,rating_n/viewers(%),desc
S6E4 The Doctor's Wife,6,4,S6E4,216,The Doctor's Wife,2011,2011-05-14,2.3,7.97,7970000.00,87,45,Neil Gaiman,Richard Clark,Matt Smith,9,7385,0.09,The Doctor is lured to a sentient asteroid outside of the Universe by a Time Lord distress signal and soon realises his TARDIS is in grave danger.
S6E5 The Rebel Flesh,6,5,S6E5,217a,The Rebel Flesh,2011,2011-05-21,2.5,7.35,7350000.00,85,45,Matthew Graham,Julian Simpson,Matt Smith,7.2,4976,0.07,"A solar tsunami sends the TARDIS crew to an acid mining factory in the 22nd century, where a small team of workers come under attack from their doppelgangers."
S6E6 The Almost People,6,6,S6E6,217b,The Almost People,2011,2011-05-28,2.6,6.72,6720000.00,86,45,Matthew Graham,Julian Simpson,Matt Smith,7.4,4928,0.07,The gangers and humans battle for their lives as the factory crumbles and the Doctor tries to keep the peace - can everyone make it off the island alive?
S6E7 A Good Man Goes to War,6,7,S6E7,218,A Good Man Goes to War,2011,2011-06-04,2.7,7.51,7510000.00,88,50,Steven Moffat,Peter Hoar,Matt Smith,9.1,7097,0.09,A member of The Doctor's team has been abducted and he will call in every favor and maybe even go to war to get them back.
S6E8 Let's Kill Hitler,6,8,S6E8,219,Let's Kill Hitler,2011,2011-08-27,2.8,8.1,8100000.0,85,50,Steven Moffat,Richard Senior,Matt Smith,8,5680,0.07,"The search for Melody Pond brings the Doctor and his friends to Berlin in 1938, face-to-face with Adolf Hitler, River Song and a justice-serving, shapeshifting robot."
S6E9 Night Terrors,6,9,S6E9,220,Night Terrors,2011,2011-09-03,2.4,7.07,7070000.00,86,45,Mark Gatiss,Richard Clark,Matt Smith,7,4867,0.07,"Receiving a powerful distress call from a terrified little boy, the Doctor and his friends soon find that the monsters in his cupboard are real - and deadly."
S6E10 The Girl Who Waited,6,10,S6E10,221,The Girl Who Waited,2011,2011-09-10,2.10,7.6,7600000.0,85,45,Tom MacRae,Nick Hurran,Matt Smith,8.5,5693,0.07,"Amy is trapped in a quarantine facility where time moves faster than in reality, while the Doctor is confined to the TARDIS. Can Rory save his wife in time?"
S6E11 The God Complex,6,11,S6E11,222,The God Complex,2011,2011-09-17,2.11,6.77,6770000.00,86,50,Toby Whithouse,Nick Hurran,Matt Smith,8.1,5291,0.08,"The Doctor, Amy and Rory become trapped in a hotel of horrors unable to escape and unable to find the TARDIS. The Doctor must save as many people as he can taking many twists and seeing his own worst fear."
S6E12 Closing Time,6,12,S6E12,223,Closing Time,2011,2011-09-24,2.12,6.93,6930000.00,86,45,Gareth Roberts,Steve Hughes,Matt Smith,7.6,4946,0.07,"The Doctor makes one last stop before his death to see an old friend. But people are disappearing, there are reports of a silver rat and metal men are lurking in the shadows."
S6E13 The Wedding of River Song,6,13,S6E13,224,The Wedding of River Song,2011,2011-10-01,2.13,7.67,7670000.00,86,45,Steven Moffat,Jeremy Webb,Matt Smith,8.4,6048,0.08,"April 22nd, 2011; 5:02pm. Having finally accepted his fate the Doctor travels to Lake Silencio for his final day. But one woman refuses to let time take its course."
"S7E0 The Doctor, the Widow and the Wardrobe",7,0,S7E0,225,"The Doctor, the Widow and the Wardrobe",2011,2011-12-25,NA,10.77,10770000.00,84,60,Steven Moffat,Farren Blackburn,Matt Smith,7.2,5255,0.05,"It's Christmas Eve, 1938, when Madge Arwell comes to the aid of an injured Spaceman Angel as she cycles home. He promises to repay her kindness - all she has to do is make a wish. Three years later, a devastated Madge escapes war-torn London with her two children for a dilapidated house in Dorset. She is crippled with grief at the news her husband has been lost over the channel, but determined to give Lily and Cyril the best Christmas ever. The Arwells are surprised to be greeted by a madcap caretaker whose mysterious Christmas gift leads them into a magical wintry ..."
S7E1 Asylum of the Daleks,7,1,S7E1,226,Asylum of the Daleks,2012,2012-09-01,NA,8.33,8330000.00,89,50,Steven Moffat,Nick Hurran,Matt Smith,8.6,6919,0.08,"Amy, Rory and the Doctor are reunited when they are kidnapped by the Daleks, who send them on a mission to destroy the most horrifying place in the universe- the asylum of the Daleks."
S7E2 Dinosaurs on a Spaceship,7,2,S7E2,227,Dinosaurs on a Spaceship,2012,2012-09-08,NA,7.57,7570000.00,87,45,Chris Chibnall,Saul Metzstein,Matt Smith,7.3,5726,0.08,"The doctor gathers some of his old friends to help him investigate an unmanned spaceship on a crash course to earth that when it collides, will destroy it, they soon discover the ship's precious and dangerous cargo- dinosaurs."
S7E3 A Town Called Mercy,7,3,S7E3,228,A Town Called Mercy,2012,2012-09-15,NA,8.42,8420000.00,85,45,Toby Whithouse,Saul Metzstein,Matt Smith,7.3,5482,0.07,"The Doctor gets a Stetson (and a gun), and finds himself the reluctant Sheriff of a Western town under siege by a relentless cyborg who goes by the name of The Gunslinger. But who is he and what does he want?"
S7E4 The Power of Three,7,4,S7E4,229,The Power of Three,2012,2012-09-22,NA,7.67,7670000.00,87,41,Chris Chibnall,Douglas Mackinnon,Matt Smith,7.5,5310,0.07,"Earth is suddenly visited by millions of small black cubes of unknown origin. The Doctor joins Amy, Rory and Rory's father, Brian, to help discover what these cubes bring for humanity."
S7E5 The Angels Take Manhattan,7,5,S7E5,230,The Angels Take Manhattan,2012,2012-09-29,NA,7.82,7820000.00,88,45,Steven Moffat,Nick Hurran,Matt Smith,9,7591,0.1,"After Rory has an encounter with a weeping angel, the doctor and Amy travel to 1930's New York to save him, but they soon discover that the weeping angels have taken over Manhattan, and soon, maybe, the world."
S7E6 The Snowmen,7,6,S7E6,231,The Snowmen,2012,2012-12-25,NA,9.87,9870000.00,87,60,Steven Moffat,Saul Metzstein,Matt Smith,8.4,6260,0.06,"London, 1892. Snow is evolving, turning into icy monstrosities, but this is no concern for the Doctor who has given up trying to save the universe, leaving it to a clever young governess named Clara to save the day."
S7E7 The Bells of Saint John,7,7,S7E7,232,The Bells of Saint John,2013,2013-03-30,NA,8.44,8440000.00,87,45,Steven Moffat,Colm McCarthy,Matt Smith,7.9,5410,0.06,"The doctor finds Clara in present day, where they work together to solve the mystery of people disappearing which as it turns out, has a sinister link to WiFi."
S7E8 The Rings of Akhaten,7,8,S7E8,233,The Rings of Akhaten,2013,2013-04-06,NA,7.45,7450000.00,84,44,Neil Cross,Farren Blackburn,Matt Smith,7.3,5851,0.08,"The doctor takes Clara to the rings of Akheten, A partly destroyed planet, where a religious ceremony is about to be carried out, but a darkness is stirring, a hungry darkness that could consume the rings of Akhetan and the universe."
S7E9 Cold War,7,9,S7E9,234,Cold War,2013,2013-04-13,NA,7.37,7370000.00,84,45,Mark Gatiss,Douglas Mackinnon,Matt Smith,7.1,5001,0.07,"The doctor and Clara find themselves on a Russian cold war submarine that is falling to the bottom of the ocean because of an attack by a rogue Martian warrior, that 's still aboard."
S7E10 Hide,7,10,S7E10,235,Hide,2013,2013-04-20,NA,6.61,6610000.00,85,45,Neil Cross,Jamie Payne,Matt Smith,7.6,4962,0.08,The Doctor and Clara arrive at a supposedly haunted mansion where they find a ghost hunter and a psychic who are on the search for a legendary ghost known as 'the witch of the well'
S7E11 Journey to the Centre of the TARDIS,7,11,S7E11,236,Journey to the Centre of the TARDIS,2013,2013-04-27,NA,6.5,6500000.0,85,45,Stephen Thompson,Mat King,Matt Smith,7.4,5012,0.08,"After the TARDIS is caught accidentally by an outer space trash collector, Clara is trapped deep inside of it where she finds herself on a journey through the doctor's past and her future."
S7E12 The Crimson Horror,7,12,S7E12,237,The Crimson Horror,2013,2013-05-04,NA,6.47,6470000.00,85,45,Mark Gatiss,Saul Metzstein,Matt Smith,7.3,4779,0.07,"When they find a picture of the Doctor in a recently dead man's eye, it's up to Madame Vastra, Jenny and Strax to save The Doctor and find out what sinister secrets are going on at Sweetsville, Yorkshire."
S7E13 Nightmare in Silver,7,13,S7E13,238,Nightmare in Silver,2013,2013-05-11,NA,6.64,6640000.00,84,45,Neil Gaiman,Stephen Woolfenden,Matt Smith,7.3,4809,0.07,"the doctor takes Clara and the children she babysits to a rundown amusement park in space where Cybermen are hiding, and ready to invade the most precious place in the universe, The Doctor's mind."
S7E14 The Name of the Doctor,7,14,S7E14,239,The Name of the Doctor,2013,2013-05-18,NA,7.45,7450000.00,88,45,Steven Moffat,Saul Metzstein,Matt Smith,9,7323,0.1,"The Doctor's friends are being kidnapped, which leads him to the fields of Trenzalore, where his greatest secret will be revealed and Clara's mystery will be solved."
Special(15th Ann) The Day of the Doctor,Special,1,Special(15th Ann),240,The Day of the Doctor,2013,2013-11-23,NA,12.8,12800000.0,88,77,Steven Moffat,Nick Hurran,Matt Smith,9.3,20238,0.16,"In 2013, something terrible is awakening in London's National Gallery; in 1562, a murderous plot is afoot in Elizabethan England; and somewhere in space an ancient battle reaches its devastating conclusion."
S8E0 The Time of the Doctor,8,0,S8E0,241,The Time of the Doctor,2013,2013-12-25,NA,11.14,11140000.00,83,60,Steven Moffat,Jamie Payne,Matt Smith,8.4,6500,0.06,"The Doctor's worst enemies, The Daleks, The Cybermen, The Angels and The Silence, return, as the doctor's eleventh life comes to a close, and his twelfth life begins."
S8E1 Deep Breath,8,1,S8E1,242,Deep Breath,2014,2014-08-23,NA,9.17,9170000.00,82,76,Steven Moffat,Ben Wheatley,Peter Capaldi,7.9,7546,0.08,"When the newly-regenerated doctor arrives in Victorian London, he finds a dinosaur rampant in the Thames and a spate of deadly spontaneous combustions."
S8E2 Into the Dalek,8,2,S8E2,243,Into the Dalek,2014,2014-08-30,NA,7.29,7290000.00,84,45,Steven Moffat,Ben Wheatley,Peter Capaldi,7.6,5964,0.08,Know what this is about? Be the first one to add a plot.
S8E3 Robot of Sherwood,8,3,S8E3,244,Robot of Sherwood,2014,2014-09-06,NA,7.28,7280000.00,82,46,Mark Gatiss,Paul Murphy,Peter Capaldi,7,6103,0.08,"In Sherwood Forest, the Doctor uncovers a sinister alien plot and forms an alliance with Robin Hood. With Nottingham at stake, the Doctor must decide who is real and who is fake."
S8E4 Listen,8,4,S8E4,245,Listen,2014,2014-09-13,NA,7.01,7010000.00,82,48,Steven Moffat,Douglas Mackinnon,Peter Capaldi,8.9,7605,0.11,"When ghosts of past and future crowd into their lives, The Doctor and Clara are thrown into an adventure that takes them to the very end of the universe."
S8E5 Time Heist,8,5,S8E5,246,Time Heist,2014,2014-09-20,NA,6.99,6990000.00,84,45,Steven Moffat,Douglas Mackinnon,Peter Capaldi,7.9,5591,0.08,"The Doctor and Clara wake up in a room with two other people, unable to remember how they got there. As it turns out Someone known as the Architect has employed them to Break into the Universe's most secure bank."
S8E6 The Caretaker,8,6,S8E6,247,The Caretaker,2014,2014-09-27,NA,6.82,6820000.00,83,45,Steven Moffat,Paul Murphy,Peter Capaldi,7.2,4931,0.07,"The terrifying Skovox Blitzer is ready to destroy all humanity - but worse, and any second now, Danny Pink and the Doctor are going to meet."
S8E7 Kill the Moon,8,7,S8E7,248,Kill the Moon,2014,2014-10-04,NA,6.91,6910000.00,82,45,Peter Harness,Paul Wilmshurst,Peter Capaldi,6.8,5666,0.08,"In the near future, the Doctor and Clara find themselves on a space shuttle making a suicide mission to the Moon. Crash-landing on the lunar surface they find the most terrible things."
S8E8 Mummy on the Orient Express,8,8,S8E8,249,Mummy on the Orient Express,2014,2014-10-11,NA,7.11,7110000.00,85,47,Jamie Mathieson,Paul Wilmshurst,Peter Capaldi,8.5,5526,0.08,"On the most beautiful train in history, speeding amongst the stars of the future, a deadly and immortal creature is stalking the passengers."
S8E9 Flatline,8,9,S8E9,250,Flatline,2014,2014-10-18,NA,6.71,6710000.00,85,43,Jamie Mathieson,Douglas Mackinnon,Peter Capaldi,8.4,5256,0.08,"A problem happens with the Tardis, trapping the Doctor inside and leaving Clara to fend for herself against a two dimensional enemy."
S8E10 In the Forest of the Night,8,10,S8E10,251,In the Forest of the Night,2014,2014-10-25,NA,6.92,6920000.00,83,45,Frank Cottrell-Boyce,Sheree Folkson,Peter Capaldi,6,5123,0.07,"One morning in London, and every city and town in the world, the human race wakes up to the most surprising invasion yet: the trees have moved back in. Everywhere, in every land, a forest has grown and taken back the Earth."
S8E11 Dark Water,8,11,S8E11,252a,Dark Water,2014,2014-11-01,NA,7.34,7340000.00,85,46,Steven Moffat,Rachel Talalay,Peter Capaldi,8.6,5542,0.08,"In the mysterious world of the Nethersphere, plans have been drawn. Old friends and old enemies manoeuvre around the Doctor, and an impossible choice is looming over him."
S8E12 Death in Heaven,8,12,S8E12,252b,Death in Heaven,2014,2014-11-08,NA,7.6,7600000.0,83,57,Steven Moffat,Rachel Talalay,Peter Capaldi,7.8,5308,0.07,"With Cybermen on the streets of London, old friends unite against old enemies and the Doctor takes to the air in a startling new role. As the Doctor faces his greatest challenge, sacrifices must be made before the day is won."
S9E0 Last Christmas,9,0,S9E0,253,Last Christmas,2014,2014-12-25,NA,8.28,8280000.00,82,60,Steven Moffat,Paul Wilmshurst,Peter Capaldi,8.2,5241,0.06,"The Doctor and Clara face their Last Christmas. Trapped on an Arctic base, under attack from terrifying creatures, who are you going to call? Santa Claus!"
S9E1 The Magician's Apprentice,9,1,S9E1,254a,The Magician's Apprentice,2015,2015-09-19,NA,6.54,6540000.00,84,46,Steven Moffat,Hettie MacDonald,Peter Capaldi,8.4,5750,0.09,"When the skies of Earth are frozen by a mysterious alien force, Clara needs her friend, the Doctor. But where is he and what is he hiding from?"
S9E2 The Witch's Familiar,9,2,S9E2,254b,The Witch's Familiar,2015,2015-09-26,NA,5.71,5710000.00,83,48,Steven Moffat,Hettie MacDonald,Peter Capaldi,8.4,5106,0.09,"Trapped and alone in a terrifying Dalek city, the Doctor is at the heart of an evil Empire; no sonic, no TARDIS, nobody to help. With his greatest temptation before him, can the Doctor resist? And will there be mercy?"
S9E3 Under the Lake,9,3,S9E3,255a,Under the Lake,2015,2015-10-03,NA,5.63,5630000.00,84,43,Toby Whithouse,Daniel O'Hara,Peter Capaldi,8.2,4899,0.09,The Doctor and Clara find themselves on a underwater station where the crew live in fear of deadly ghosts which have taken over the station.
S9E4 Before the Flood,9,4,S9E4,255b,Before the Flood,2015,2015-10-10,NA,6.05,6050000.00,83,42,Toby Whithouse,Daniel O'Hara,Peter Capaldi,8.1,4617,0.08,"In a town that never was, the Doctor and his friends are being stalked by a mysterious figure. With the past and future in the balance, can the Doctor stop the evil Fisher King? And more importantly, who composed Beethoven's 5th."
S9E5 The Girl Who Died,9,5,S9E5,256,The Girl Who Died,2015,2015-10-17,NA,6.56,6560000.00,82,46,Steven Moffat,Ed Bazalgette,Peter Capaldi,7.5,4673,0.07,"In a Viking village, a girl named Ashildr is about to make a desperate mistake. The Mire are the deadliest mercenaries in the galaxy, famed for showing no mercy and Ashildr has just declared war on them. The Doctor and Clara have 12 hours to turn a peaceful village into strong fighters, ready for the deadly Mire."
S9E6 The Woman Who Lived,9,6,S9E6,257,The Woman Who Lived,2015,2015-10-24,NA,6.11,6110000.00,81,46,Catherine Tregenna,Ed Bazalgette,Peter Capaldi,7.4,4527,0.07,"England, 1651. A deadly highwayman known only as 'The Knightmare' plagues the dark streets of London, his fire-breathing accomplice by his side. There's something clearly more than human here, and that includes the loot as much as the outlaws. Who are these creatures, and are they enemies to be fought, or friends who might possibly save the Doctor from certain doom on the gallows?"
S9E7 The Zygon Invasion,9,7,S9E7,258a,The Zygon Invasion,2015,2015-10-31,NA,5.76,5760000.00,82,46,Peter Harness,Daniel Nettheim,Peter Capaldi,7.8,4396,0.08,"Zygons, a shape-shifting alien race, and humans live in peace together on earth, but a group of rogue zygons threaten the peace between humans and zygons."
S9E8 The Zygon Inversion,9,8,S9E8,258b,The Zygon Inversion,2015,2015-11-07,NA,6.03,6030000.00,84,46,Steven Moffat,Daniel Nettheim,Peter Capaldi,8.5,4775,0.08,"With the Zygons invading England, and UNIT neutralized, the Doctor stands alone to stop the Zygons from taking over the entire planet. But how can he stop the Zygons? And how can he save his friends?"
S9E9 Sleep No More,9,9,S9E9,259,Sleep No More,2015,2015-11-14,NA,5.61,5610000.00,78,45,Mark Gatiss,Justin Molotnikov,Peter Capaldi,5.8,4838,0.09,"Vision recovered from the wreckage of Le Verrier Space Station shows how the Doctor and Clara became entangled in a rescue mission. As the footage plays out, a horrifying secret is uncovered."
S9E10 Face the Raven,9,10,S9E10,260,Face the Raven,2015,2015-11-21,NA,6.05,6050000.00,84,47,Sarah Dollard,Justin Molotnikov,Peter Capaldi,8.5,5288,0.09,"The Doctor and Clara are called back to Earth when Rigsy discovers a strange tattoo on the back of his neck that appears to be counting down to zero. Their investigation leads them to a hidden street in the middle of London, the discovery that Rigsy has been issued a death sentence, and one of them facing the choice of having to make the ultimate sacrifice; to face the Raven!"
S9E11 Heaven Sent,9,11,S9E11,261,Heaven Sent,2015,2015-11-28,NA,6.19,6190000.00,80,54,Steven Moffat,Rachel Talalay,Peter Capaldi,9.6,10323,0.17,"Trapped in a world unlike any other he has seen, the Doctor faces the greatest challenge of his many lives. One final test. And he must face it alone..."
S9E12 Hell Bent,9,12,S9E12,262,Hell Bent,2015,2015-12-05,NA,6.17,6170000.00,82,61,Steven Moffat,Rachel Talalay,Peter Capaldi,8.6,5965,0.1,"If you took everything from him, betrayed him, trapped him, and broke both his hearts... how far might the Doctor go? Returning to Gallifrey, the Doctor faces the Time Lords in a struggle that will take him to the end of time itself. Who is the Hybrid? And what is the Doctor's confession?"
S9E13 The Husbands of River Song,9,13,S9E13,263,The Husbands of River Song,2015,2015-12-25,NA,7.69,7690000.00,82,56,Steven Moffat,Douglas Mackinnon,Peter Capaldi,8.5,5106,0.07,"When a crashed spaceship calls upon the Doctor for help, he finds himself recruited into River Song's squad and hurled into a chase across the galaxy."
S10E0 The Return of Doctor Mysterio,10,0,S10E0,264,The Return of Doctor Mysterio,2016,2016-12-25,NA,7.83,7830000.00,82,60,Steven Moffat,Ed Bazalgette,Peter Capaldi,7.4,4844,0.06,"In New York, with brain-swapping aliens poised to attack, the Doctor and Nardole link up with an investigative reporter and a mysterious masked superhero known only as the Ghost. Can the Doctor save Manhattan? And what will be revealed when we see behind the mask?"
S10E1 The Pilot,10,1,S10E1,265,The Pilot,2017,2017-04-15,NA,6.68,6680000.00,83,50,Steven Moffat,Lawrence Gough,Peter Capaldi,7.9,4800,0.07,The Doctor and Nardole team up with a university student to take down a sinister life-mimicking alien.
S10E2 Smile,10,2,S10E2,266,Smile,2017,2017-04-22,NA,5.98,5980000.00,83,46,Frank Cottrell-Boyce,Lawrence Gough,Peter Capaldi,7.1,4083,0.07,"The Doctor brings Bill to a future human colony, where cute EmojiBots work as willing servants and make sure everybody's happy, but if they're not happy ,they're harvested, so Bill and The Doctor better smile, or else."
S10E3 Thin Ice,10,3,S10E3,267,Thin Ice,2017,2017-04-29,NA,5.61,5610000.00,84,44,Sarah Dollard,Bill Anderson,Peter Capaldi,7.3,3920,0.07,The Doctor and Bill visit London during the last of the River Thames frost fairs in February 1814. They soon discover that there is something under the ice which is causing people to disappear.
S10E4 Knock Knock,10,4,S10E4,268,Knock Knock,2017,2017-05-06,NA,5.73,5730000.00,83,44,Mike Bartlett,Bill Anderson,Peter Capaldi,7.3,3874,0.07,"Bill is moving in with some friends and they've found the perfect house rented by the landlord. The wind blows, the floorboards creak and the Doctor thinks something is very wrong."
S10E5 Oxygen,10,5,S10E5,269,Oxygen,2017,2017-05-13,NA,5.27,5270000.00,83,45,Jamie Mathieson,Charles Palmer,Peter Capaldi,8.1,3992,0.08,"When the Doctor, Bill and Nardole become trapped on a space station without oxygen, they discover the spacesuits are trying to kill them."
S10E6 Extremis,10,6,S10E6,270,Extremis,2017,2017-05-20,NA,5.53,5530000.00,82,49,Steven Moffat,Daniel Nettheim,Peter Capaldi,8.4,4112,0.07,"The Doctor is called by the Vatican to solve the mystery of a text called the Veritas, that when someone reads it dies soon after. But something is dwelling in the Vatican, and doesn't want the Veritas to be read."
S10E7 The Pyramid at the End of the World,10,7,S10E7,271,The Pyramid at the End of the World,2017,2017-05-27,NA,5.79,5790000.00,82,46,Steven Moffat,Daniel Nettheim,Peter Capaldi,7.6,3566,0.06,"A 5,000-year-old pyramid appears overnight, baffling everyone including the Doctor."
S10E8 The Lie of the Land,10,8,S10E8,272,The Lie of the Land,2017,2017-06-03,NA,4.82,4820000.00,82,45,Toby Whithouse,Wayne Yip,Peter Capaldi,7.1,3461,0.07,"Earth is invaded and Bill is living alone in occupied Britain. The Doctor appears to be on the side of the enemy, flooding the airwaves with fake news. Bill and Nardole embark on a deadly mission to rescue the Doctor and lead the resistance against the new regime, whatever the cost."
S10E9 Empress of Mars,10,9,S10E9,273,Empress of Mars,2017,2017-06-10,NA,5.02,5020000.00,83,44,Mark Gatiss,Wayne Yip,Peter Capaldi,7,3416,0.07,"The Doctor, Bill and Nardole discover a tomb of the Queen of the Ice Warriors on Mars in 1881."
S10E10 The Eaters of Light,10,10,S10E10,274,The Eaters of Light,2017,2017-06-17,NA,4.73,4730000.00,81,42,Rona Munro,Charles Palmer,Peter Capaldi,6.8,3400,0.07,"A long time ago, the Roman legion of the ninth vanished into the mists of Scotland. Bill has a theory about what happened, and the Doctor has a time machine. But when they arrive in ancient Aberdeenshire, what they find is a far greater threat than any army. In a cairn, on a hillside, is a doorway leading to the end of the world."
S10E11 World Enough and Time,10,11,S10E11,275a,World Enough and Time,2017,2017-06-24,NA,5,5000000,85,46,Steven Moffat,Rachel Talalay,Peter Capaldi,9.2,4802,0.1,"Trapped on a giant spaceship, caught in the event horizon of a black hole, he witnesses the death of someone he is pledged to protect. Are events already out of control?"
S10E12 The Doctor Falls,10,12,S10E12,275b,The Doctor Falls,2017,2017-07-01,NA,5.3,5300000.0,83,60,Steven Moffat,Rachel Talalay,Peter Capaldi,9,4807,0.09,The Doctor makes a final stand against an army of Cybermen to protect a tiny band of humans from destruction.
S11E0 Twice Upon a Time,11,0,S11E0,276,Twice Upon a Time,2017,2017-12-25,NA,7.92,7920000.00,81,60,Steven Moffat,Rachel Talalay,Peter Capaldi,8.1,6378,0.08,"The Twelfth Doctor, still refusing to change, goes on a last adventure with the First Doctor."
S11E1 The Woman Who Fell to Earth,11,1,S11E1,277,The Woman Who Fell to Earth,2018,2018-10-07,NA,10.96,10960000.00,83,64,Chris Chibnall,Jamie Childs,Jodie Whittaker,6.8,10091,0.09,"In a South Yorkshire city, Ryan Sinclair, Yasmin Khan and Graham O'Brien are about to have their lives changed forever, as a mysterious woman, unable to remember her own name, falls from the night sky."
S11E2 The Ghost Monument,11,2,S11E2,278,The Ghost Monument,2018,2018-10-14,NA,9,9000000,82,49,Chris Chibnall,Mark Tonderai,Jodie Whittaker,5.9,7791,0.09,"Still reeling from their first encounter, can the Doctor and her new friends stay alive long enough, in a hostile alien environment, to solve the mystery of Desolation? And just who are Angstrom and Epzo?"
S11E3 Rosa,11,3,S11E3,279,Rosa,2018,2018-10-21,NA,8.41,8410000.00,83,50,Chris Chibnall,Mark Tonderai,Jodie Whittaker,6.9,9174,0.11,"Montgomery, Alabama, 1955. The Doctor and her friends find themselves in the Deep South of America. As they encounter a seamstress by the name of Rosa Parks, they begin to wonder whether someone is attempting to change history."
S11E4 Arachnids in the UK,11,4,S11E4,280,Arachnids in the UK,2018,2018-10-28,NA,8.22,8220000.00,83,49,Chris Chibnall,Sallie Aprahamian,Jodie Whittaker,4.9,7109,0.09,"The Doctor, Yaz, Graham, and Ryan find their way back to Yorkshire only to find something is stirring amidst the eight-legged arachnid population of Sheffield."
S11E5 The Tsuranga Conundrum,11,5,S11E5,281,The Tsuranga Conundrum,2018,2018-11-04,NA,7.76,7760000.00,79,51,Chris Chibnall,Jennifer Perrott,Jodie Whittaker,4.9,6577,0.08,"Injured and stranded in the wilds of a far-flung galaxy, The Doctor, Yaz, Graham, and Ryan must band together with a group of strangers to survive against one of the universe's most deadly - and unusual - creatures."
S11E6 Demons of the Punjab,11,6,S11E6,282,Demons of the Punjab,2018,2018-11-11,NA,7.48,7480000.00,80,50,Vinay Patel,Jamie Childs,Jodie Whittaker,6.4,6644,0.09,"Yasmin travels in time to visit her grandmother during her youth in the partition of India, but everyone gets caught up in the tragic bloodshed of that era."
